{
  "id": "slow-breathing",
  "version": 1,
  "displayName": "Postura para respirar cómodamente",
  "categories": ["demostración de movimiento"],
  "goals": ["Observar postura para respirar cómodamente"],
  "space": {
    "widthM": 2,
    "lengthM": 2
  },
  "equipment": [],
  "impact": "low",
  "sidePolicy": "none",
  "animation": {
    "assetId": "quaternius-slow-breathing-v1",
    "clipName": "EX_slow-breathing__comfortable-standing__v1",
    "loopable": false,
    "cameraPresets": ["side", "front", "threeQuarter"]
  },
  "cues": [
    "Permanece en una postura cómoda, con ambos pies apoyados.",
    "Relaja los brazos y deja fluir la respiración sin forzarla.",
    "No necesitas acompasar la respiración al reloj o al avatar."
  ],
  "commonErrors": [
    "Forzar el recorrido para copiar al avatar.",
    "Acelerar sin conservar los apoyos y el control indicados."
  ],
  "regressionId": null,
  "progressionId": null,
  "footballTransfer": [],
  "safetyCues": [
    "Demostración en revisión: esta prueba del reproductor no es una rutina para seguir.",
    "Dolor, bloqueo, inflamación o inestabilidad reales: detente y busca valoración.",
    "El recorrido, la cadencia y las repeticiones del avatar no determinan tu dosis personal."
  ],
  "reviewStatus": "draft"
}
