{
  "id": "hip-hinge",
  "version": 1,
  "displayName": "Bisagra de cadera",
  "categories": ["patrón de movimiento"],
  "goals": ["Observar la flexión desde la cadera con los pies apoyados"],
  "space": { "widthM": 2, "lengthM": 2 },
  "equipment": [],
  "impact": "low",
  "sidePolicy": "none",
  "animation": {
    "assetId": "quaternius-hip-hinge-v1",
    "clipName": "EX_hip-hinge__neutral__v1",
    "loopable": false,
    "cameraPresets": ["side", "front", "threeQuarter"]
  },
  "cues": [
    "Pies separados y completamente apoyados.",
    "Cadera hacia atrás; rodillas ligeramente flexionadas.",
    "Tronco y cuello alineados; respira sin contener el aire.",
    "Vuelve de forma controlada, sin inclinarte hacia atrás al terminar."
  ],
  "commonErrors": [
    "Redondear o arquear exageradamente la espalda.",
    "Convertir el gesto en una sentadilla profunda.",
    "Levantar los talones o forzar el recorrido para copiar al avatar."
  ],
  "regressionId": null,
  "progressionId": null,
  "footballTransfer": [],
  "safetyCues": [
    "Demostración en revisión: esta prueba del reproductor no es una rutina para seguir.",
    "Dolor, bloqueo, inflamación o inestabilidad reales: detente y busca valoración.",
    "El recorrido, la cadencia y las repeticiones del avatar no determinan tu dosis personal."
  ],
  "reviewStatus": "draft"
}
