{
  "id": "active-march",
  "version": 2,
  "displayName": "Marcha en el sitio",
  "categories": ["demostración de movimiento"],
  "goals": ["Observar marcha en el sitio"],
  "space": {
    "widthM": 2,
    "lengthM": 2
  },
  "equipment": [],
  "impact": "low",
  "sidePolicy": "alternate",
  "animation": {
    "assetId": "quaternius-active-march-v2",
    "clipName": "EX_active-march__alternate__v2",
    "loopable": false,
    "cameraPresets": ["side", "front", "threeQuarter"]
  },
  "cues": [
    "Alterna los pasos en el sitio, sin saltar ni correr.",
    "Acompaña cada pierna con el brazo contrario, con los codos flexionados.",
    "Deja los hombros relajados y conserva un ritmo cómodo."
  ],
  "commonErrors": [
    "Forzar el recorrido para copiar al avatar.",
    "Acelerar sin conservar los apoyos y el control indicados."
  ],
  "regressionId": null,
  "progressionId": null,
  "footballTransfer": [],
  "safetyCues": [
    "Demostración en revisión: esta prueba del reproductor no es una rutina para seguir.",
    "Dolor, bloqueo, inflamación o inestabilidad reales: detente y busca valoración.",
    "El recorrido, la cadencia y las repeticiones del avatar no determinan tu dosis personal."
  ],
  "reviewStatus": "draft"
}
