{
  "id": "mini-squat",
  "version": 2,
  "displayName": "Sentadilla corta",
  "categories": ["demostración de movimiento"],
  "goals": ["Observar sentadilla corta"],
  "space": {
    "widthM": 2,
    "lengthM": 2
  },
  "equipment": [],
  "impact": "low",
  "sidePolicy": "none",
  "animation": {
    "assetId": "quaternius-mini-squat-v2",
    "clipName": "EX_mini-squat__bilateral__v2",
    "loopable": false,
    "cameraPresets": ["side", "front", "threeQuarter"]
  },
  "cues": [
    "Pies apoyados y separados de forma cómoda.",
    "Flexiona rodillas y caderas con un recorrido corto.",
    "Mantén los talones apoyados y las rodillas orientadas con los pies.",
    "Regresa de forma controlada; no fuerces la profundidad."
  ],
  "commonErrors": [
    "Forzar el recorrido para copiar al avatar.",
    "Acelerar sin conservar los apoyos y el control indicados."
  ],
  "regressionId": null,
  "progressionId": null,
  "footballTransfer": [],
  "safetyCues": [
    "Demostración en revisión: esta prueba del reproductor no es una rutina para seguir.",
    "Dolor, bloqueo, inflamación o inestabilidad reales: detente y busca valoración.",
    "El recorrido, la cadencia y las repeticiones del avatar no determinan tu dosis personal."
  ],
  "reviewStatus": "draft"
}
