{
  "id": "inside-outside-left",
  "version": 3,
  "displayName": "Interior/exterior · pie izquierdo",
  "categories": ["demostración de movimiento"],
  "goals": ["Observar interior/exterior · pie izquierdo"],
  "space": {
    "widthM": 2,
    "lengthM": 2
  },
  "equipment": ["ball"],
  "impact": "low",
  "sidePolicy": "explicit",
  "animation": {
    "assetId": "quaternius-inside-outside-left-v2",
    "clipName": "EX_inside-outside__left__v2",
    "loopable": false,
    "cameraPresets": ["side", "front", "threeQuarter", "detail"]
  },
  "cues": [
    "El pie derecho sostiene el apoyo.",
    "Acerca el balón con el interior izquierdo.",
    "Recoloca ese pie por detrás del balón, sin pisarlo.",
    "Devuélvelo con el exterior del mismo pie y vuelve al inicio."
  ],
  "commonErrors": [
    "Forzar el recorrido para copiar al avatar.",
    "Acelerar sin conservar los apoyos y el control indicados."
  ],
  "regressionId": null,
  "progressionId": null,
  "footballTransfer": [],
  "safetyCues": [
    "Demostración en revisión: esta prueba del reproductor no es una rutina para seguir.",
    "Dolor, bloqueo, inflamación o inestabilidad reales: detente y busca valoración.",
    "El recorrido, la cadencia y las repeticiones del avatar no determinan tu dosis personal."
  ],
  "reviewStatus": "draft"
}
